<?xml version="1.0" encoding="UTF-8"?>

<spell:spell xmlns:spell="http://www.swordsandsorcery.com/spell"
             xmlns:xsi="http://www.w3.org/2001/XMLSchema-instance"
             xsi:schemaLocation="http://www.swordsandsorcery.com/spell ../schema.xsd">
    <spell:id>1</spell:id>
    <spell:name>Heal</spell:name>
    <spell:type>RESTORATION</spell:type>
    <spell:combat-spell>true</spell:combat-spell>
    <spell:cost-list>
        <spell:cost>
            <spell:cost-type>MANA</spell:cost-type>
            <spell:cost-amount>3</spell:cost-amount>
        </spell:cost>
    </spell:cost-list>
    <spell:effect-list>
        <spell:effect target="com.morethanheroic.swords.combat.domain.effect.entry.HealCombatEffectDefinition">
            <spell:settings-list>
                <spell:effect-setting>
                    <spell:setting-name>amount</spell:setting-name>
                    <spell:setting-value>8</spell:setting-value>
                </spell:effect-setting>
            </spell:settings-list>
        </spell:effect>
    </spell:effect-list>
</spell:spell>